{
  "id": "660e8400-e29b-41d4-a716-446655440001",
  "schema_version": {
    "major": 1,
    "minor": 0,
    "patch": 0,
    "schema_uri": "https://relic-oss.dev/schemas/agent_embodiment_pack/v1"
  },
  "checksum": "b2c3d4e5f6789012345678901234567890abcdef1234567890abcdef1234567a",
  "source_snapshot_id": "660e8400-e29b-41d4-a716-446655440010",
  "lineage_refs": [],
  "correction_cutoff": {
    "cutoff_timestamp": "2024-01-15T10:30:00Z",
    "corrections_applied": [],
    "corrections_pending": [],
    "verified": true
  },
  "embodiment_type": "text",
  "capabilities": [
    "text_generation",
    "reasoning",
    "code_completion"
  ],
  "constraints": [
    "no_file_system_access",
    "no_network_access",
    "privacy_first"
  ],
  "persona_profile": {
    "name": "Gumi",
    "tone": "friendly",
    "intensity": 0.7
  },
  "metadata": {},
  "created_at": "2024-01-15T10:30:00Z"
}
